{
  "$schema": "https://json-schema.org/draft/2020-12/schema",
  "$id": "urn:ironclaw:icwm-g0c:harness-result:v1",
  "title": "ICWM Gate 0C candidate-neutral harness result",
  "type": "object",
  "additionalProperties": false,
  "required": [
    "schema_version",
    "candidate",
    "dependency_graph",
    "harness_commit",
    "component_commits",
    "scenario_hash",
    "vector_hashes",
    "tier",
    "homeservers",
    "clients",
    "disposition",
    "effects",
    "failpoints_reached",
    "crashes",
    "response_losses",
    "evidence_hashes",
    "capability_disposition_reasons"
  ],
  "properties": {
    "schema_version": { "const": "icwm.g0c.harness-result.v1" },
    "candidate": { "$ref": "#/$defs/identity" },
    "dependency_graph": {
      "type": "object",
      "additionalProperties": false,
      "required": ["sha256", "artifact"],
      "properties": {
        "sha256": { "$ref": "#/$defs/sha256" },
        "artifact": { "type": "string", "minLength": 1 }
      }
    },
    "harness_commit": { "$ref": "#/$defs/gitCommit" },
    "component_commits": {
      "type": "object",
      "minProperties": 1,
      "additionalProperties": { "$ref": "#/$defs/gitCommit" }
    },
    "scenario_hash": { "$ref": "#/$defs/sha256" },
    "vector_hashes": {
      "type": "object",
      "minProperties": 1,
      "additionalProperties": { "$ref": "#/$defs/sha256" }
    },
    "tier": { "enum": ["deterministic", "live"] },
    "homeservers": {
      "type": "array",
      "items": { "$ref": "#/$defs/identity" }
    },
    "clients": {
      "type": "array",
      "items": { "$ref": "#/$defs/identity" }
    },
    "disposition": {
      "enum": ["supported", "failed", "uncertain", "infeasible", "not_applicable"]
    },
    "disposition_reason": { "type": "string", "minLength": 1 },
    "effects": {
      "type": "array",
      "items": {
        "type": "object",
        "additionalProperties": false,
        "required": ["sequence", "at_ms", "effect_id", "kind", "semantic_digest"],
        "properties": {
          "sequence": { "type": "integer", "minimum": 0 },
          "at_ms": { "type": "integer", "minimum": 0 },
          "effect_id": { "$ref": "#/$defs/sha256" },
          "kind": { "type": "string", "minLength": 1 },
          "semantic_digest": { "$ref": "#/$defs/sha256" }
        }
      }
    },
    "failpoints_reached": {
      "type": "array",
      "uniqueItems": true,
      "items": { "$ref": "#/$defs/failpoint" }
    },
    "crashes": {
      "type": "array",
      "items": {
        "type": "object",
        "additionalProperties": false,
        "required": ["at_ms", "reached"],
        "properties": {
          "at_ms": { "type": "integer", "minimum": 0 },
          "reached": {
            "anyOf": [
              { "$ref": "#/$defs/failpoint" },
              { "type": "null" }
            ]
          }
        }
      }
    },
    "response_losses": {
      "type": "array",
      "items": {
        "type": "object",
        "additionalProperties": false,
        "required": ["at_ms", "phase"],
        "properties": {
          "at_ms": { "type": "integer", "minimum": 0 },
          "phase": { "enum": ["before_candidate", "after_adapter_handling"] }
        }
      }
    },
    "evidence_hashes": {
      "type": "object",
      "additionalProperties": { "$ref": "#/$defs/sha256" }
    },
    "capabilities": {
      "type": "object",
      "additionalProperties": { "type": "boolean" }
    },
    "capability_dispositions": {
      "type": "object",
      "additionalProperties": { "enum": ["supported", "failed", "uncertain", "infeasible", "not_applicable"] }
    },
    "capability_disposition_reasons": {
      "type": "object",
      "additionalProperties": { "type": "string", "minLength": 1 }
    },
    "expected_failures": {
      "type": "array",
      "items": { "$ref": "#/$defs/policyRecord" }
    },
    "waivers": {
      "type": "array",
      "items": { "$ref": "#/$defs/policyRecord" }
    },
    "blacklists": {
      "type": "array",
      "items": { "$ref": "#/$defs/policyRecord" }
    }
  },
  "allOf": [
    {
      "if": {
        "properties": {
          "disposition": { "enum": ["failed", "uncertain", "infeasible", "not_applicable"] }
        },
        "required": ["disposition"]
      },
      "then": { "required": ["disposition_reason"] }
    }
  ],
  "$defs": {
    "sha256": { "type": "string", "pattern": "^[0-9a-f]{64}$" },
    "gitCommit": { "type": "string", "pattern": "^[0-9a-f]{40}$" },
    "failpoint": {
      "enum": [
        "ledger_before_crypto_store_append",
        "ledger_after_crypto_store_append",
        "ledger_unknown_crypto_store_append",
        "ledger_before_ingress_append",
        "ledger_after_ingress_append",
        "ledger_unknown_ingress_append",
        "candidate_before_prepare",
        "candidate_after_prepare",
        "candidate_after_commit_before_acknowledge",
        "process_before_effect_append",
        "process_after_effect_append",
        "response_before_prepare",
        "response_after_commit_before_acknowledge",
        "before_prepared_ciphertext_handoff",
        "after_prepared_ciphertext_handoff",
        "stale_writer_after_takeover"
      ]
    },
    "policyRecord": {
      "type": "object",
      "additionalProperties": false,
      "required": ["scope", "reason", "evidence", "reviewer_identity"],
      "properties": {
        "scope": { "type": "string", "minLength": 1 },
        "reason": { "type": "string", "minLength": 1 },
        "evidence": { "type": "string", "minLength": 1 },
        "reviewer_identity": { "type": "string", "minLength": 1 }
      }
    },
    "identity": {
      "type": "object",
      "additionalProperties": false,
      "required": ["name", "version", "stable_id"],
      "properties": {
        "name": { "type": "string", "minLength": 1 },
        "version": { "type": "string", "minLength": 1 },
        "stable_id": { "$ref": "#/$defs/sha256" }
      }
    }
  }
}
