{
  "schema_version": "icwm.g0c.harness-result.v1",
  "candidate": {
    "name": "control",
    "version": "1",
    "stable_id": "9ffc40c2eeb5d95b57d052aa0e0b5f97f4a303c0b2f6986cf6232b3ed00ecc6d"
  },
  "dependency_graph": {
    "sha256": "9c2ffc013c58bea1d6f2c9c5357397d8c7701448e558438a57b4574c35148dd7",
    "artifact": "Cargo.lock"
  },
  "harness_commit": "d83495889fdc5ce8f7f829a120f68878b6bf42e3",
  "component_commits": {
    "ironclaw_source_baseline": "d83495889fdc5ce8f7f829a120f68878b6bf42e3"
  },
  "scenario_hash": "2427738c14018e932e4d4e7b30396f428056a4159c20d54ac58bdaff81f3f9ae",
  "vector_hashes": {
    "identifier_admission_corpus": "a3a03096323f36e9c80d8787e14d8930a78f6330e8121fbfaa7a83ae54f547f0",
    "request_vectors_v1": "2422a729df9b88f8005f34e35fe2794248412b05cdca50d0d83edeb1c4193878"
  },
  "tier": "deterministic",
  "homeservers": [],
  "clients": [],
  "disposition": "supported",
  "disposition_reason": "The control adapter exercises only candidate-neutral harness mechanics; Matrix transport and crypto capabilities are outside this control topology.",
  "effects": [
    {
      "sequence": 0,
      "at_ms": 25,
      "effect_id": "ea99c992173e0369b9f4fa5a764acaf1e68e3028a540d46566e8b134c89e2cad",
      "kind": "matrix_request",
      "semantic_digest": "c5041d0d725b32f265483bd41b04e57a341c02cdafc60ae3c6177eef31638000"
    }
  ],
  "failpoints_reached": [],
  "crashes": [],
  "response_losses": [],
  "evidence_hashes": {
    "tested_harness_source": "4501eb1462fe66c21cf1677b06b915ed9760693bef9d495f44f46c55f8f3bc9d",
    "approved_ignored_common_aggregate": "e603556c99acd3de3c69b60acb74486a858993e5bb7fe9d1bd66827ea6d3d34b"
  },
  "capabilities": {
    "ordered_effect_ledger": true,
    "scripted_response_consumption": true,
    "virtual_clock": true
  },
  "capability_dispositions": {
    "sync": "not_applicable",
    "keys_query": "not_applicable",
    "keys_claim": "not_applicable",
    "to_device": "not_applicable",
    "room_send": "not_applicable",
    "keys_upload": "not_applicable",
    "device_list": "not_applicable",
    "room_keys_backup": "not_applicable",
    "cross_signing": "not_applicable",
    "signatures_upload": "not_applicable",
    "verification": "not_applicable",
    "keys_changes": "not_applicable"
  },
  "capability_disposition_reasons": {
    "sync": "Outside the candidate-neutral control adapter topology.",
    "keys_query": "Outside the candidate-neutral control adapter topology.",
    "keys_claim": "Outside the candidate-neutral control adapter topology.",
    "to_device": "Outside the candidate-neutral control adapter topology.",
    "room_send": "Outside the candidate-neutral control adapter topology.",
    "keys_upload": "Outside the candidate-neutral control adapter topology.",
    "device_list": "Outside the candidate-neutral control adapter topology.",
    "room_keys_backup": "Outside the candidate-neutral control adapter topology.",
    "cross_signing": "Outside the candidate-neutral control adapter topology.",
    "signatures_upload": "Outside the candidate-neutral control adapter topology.",
    "verification": "Outside the candidate-neutral control adapter topology.",
    "keys_changes": "Outside the candidate-neutral control adapter topology."
  },
  "expected_failures": [],
  "waivers": [],
  "blacklists": []
}
